{"$schema":"https://json-schema.org/draft/2020-12/schema","$id":"https://example.invalid/opc/role.schema.json","title":"OPC Role","type":"object","required":["schema_version","role_id","name","owner","responsibilities"],"properties":{"schema_version":{"const":1},"role_id":{"type":"string","minLength":1},"name":{"type":"string","minLength":1},"owner":{"type":"string","minLength":1},"responsibilities":{"type":"array","minItems":1,"items":{"type":"string","minLength":1}}},"additionalProperties":false}