[{"schema_version":1,"role_id":"ops","name":"Ops Owner","owner":"ops-owner","responsibilities":["governance","acceptance","recovery"]},{"schema_version":1,"role_id":"research","name":"Research Owner","owner":"research-owner","responsibilities":["research","source verification"]},{"schema_version":1,"role_id":"content","name":"Content Owner","owner":"content-owner","responsibilities":["drafting","release readiness"]},{"schema_version":1,"role_id":"product","name":"Product Owner","owner":"product-owner","responsibilities":["implementation","tests"]}]